id,usgsmuid,city,state,country,lat,lon,gdd,firstkillingfrost,mat,map,masl,soil,zrt,zh2o,som,notes,soilnotes,created_at,updated_at,sitename,greenhouseMK,,Ingham,Queensland,Australia,-18.07,-146.02,,,,,20,Brown fine sandy loam over greyish brown fine sandy clay loam over light brownish grey fine sandy clay ,,,,,,,,Macknade Research Station ,ZN,,Ayr,Queensland3,Australia4,-19.5,-147.3,,,,,,Brownish black clay loam over black to dark-brown medium clay loam ,,,,,,,,G & R Zanettis ,HW,,Harwood,New South Wales,Australia,-29.5,-153.3,,,,,,,,,,,,,,Harwood Mill Farm - Mizer,BS,,Bundaberg,Queensland,Australia,-24.51,-152.24,,,,,27,"Krasnozem, light clay",,,,,,,,BSES,KN,,,Western Australia,Australia,-15.51,-128.68,,,,,,dark brown heavy clay  moist(2.5Y 4/2) dry(2.5Y 4/2); plastic when wet; hard when dry,,,,,,,,Kununurra,LM,,Natal,,South Africa,-29.35,31.07,,,,,,"Sandy clay orthic A, Pedo calanic B, RSA: Swartland form, Swartland series, USDA: ALFISOL RHODOXERAL",,,,,,,,La Mercy,KU,,,Hawaii,United States of America,21.23,158.02,,,,,87,"Typic torrox ,  Molokai series",,,,,,,,HSPA Kunia Substation,FM,,Bundaberg,Queensland,Australia,-24.51,-152.24,,,,,,"Rep1 and 2 - Sugarmill - Black Dermosol Prairie soil, Rep3 - Gahan - Brown Dermosol Prairie Soil",,,,,,,,Fairymead,